{
  "artifact_kind": "journey",
  "schema_version": "gravity.journey.v1",
  "journey_id": "analysis.experiment-outcome-evaluation",
  "version": 1,
  "display_name": "基于独立实验观察窗评估实验结果",
  "display_binding": {
    "legacy_display_key": "基于独立实验观察窗评估实验结果"
  },
  "lifecycle": "active",
  "owner": "gravity-runtime/experiment-outcome",
  "calling_project": null,
  "required_capabilities": [],
  "required_semantics": [],
  "required_operators": [
    "operator://gravity/significance-test@1"
  ],
  "required_models": [],
  "required_context": [],
  "required_skill": null,
  "surfaces": {
    "cli": "missing",
    "sdk": "missing",
    "plan": "missing",
    "agent": "missing"
  },
  "request_budget": {
    "known_requests_min": 0,
    "known_requests_max": 0,
    "unknown_discovery_max": 0,
    "acceptance_production_requests": 0,
    "runtime_additional_requests": 0
  },
  "claim_policy": {
    "allowed": [
      "experiment-outcome-observation"
    ],
    "forbidden": [
      "causality-without-controlled-evidence",
      "recommendation-self-validation"
    ]
  },
  "execution": {
    "mode": "unavailable",
    "owner": "experiment-outcome-evaluation",
    "path": []
  },
  "project_contract_path": null
}
