{
  "artifact_kind": "journey",
  "schema_version": "gravity.journey.v1",
  "journey_id": "analysis.ltv-curve-fit",
  "version": 1,
  "display_name": "拟合 LT/LTV 曲线并给出安全预测区间",
  "display_binding": {"legacy_display_key": "拟合 LT/LTV 曲线并给出安全预测区间"},
  "lifecycle": "active",
  "owner": "gravity-runtime/methods",
  "calling_project": null,
  "required_capabilities": [],
  "required_semantics": ["metric://project/ltv@1"],
  "required_operators": ["operator://gravity/ltv-curve-fit@1"],
  "required_models": ["model://gravity/ltv-curve@1"],
  "required_context": [],
  "required_skill": null,
  "surfaces": {"cli": "missing", "sdk": "missing", "plan": "missing", "agent": "missing"},
  "request_budget": {
    "known_requests_min": 0,
    "known_requests_max": 0,
    "unknown_discovery_max": 0,
    "acceptance_production_requests": 0,
    "runtime_additional_requests": 0
  },
  "claim_policy": {
    "allowed": [],
    "forbidden": ["unvalidated-ltv-forecast", "invented-confidence", "causality"]
  },
  "execution": {"mode": "unavailable", "owner": "operator://gravity/ltv-curve-fit@1", "path": []},
  "project_contract_path": null
}
